{
 "schema": "gamebryo_oracle/comparison_result@1.0",
 "adapter": "compare",
 "ORACLE_MODE": "MIXED",
 "era_category": "OUR_TOOL",
 "float_policy": "serialized fields bit-exact; computed world transforms computed identically on both sides from identical serialized locals (NiTransform::operator* L15-24 + UpdateWorldData L22-31), then bit-exact; no tolerance applied",
 "oracle_identity": {
  "adapter": "gb12",
  "ORACLE_MODE": "SOURCE_DERIVED_REIMPLEMENTATION",
  "loader_source_identity": {
   "file": "D:\\gamebyroengine\\extracted\\Gb12_Source\\CoreLibs\\NiMain\\NiStream.cpp",
   "sha256": "E955C36EBBB442029E00BE8A154726741B8454A607F2DC043F1FD542B009DC25",
   "semantics_provenance": "see gb12core.py header citation block"
  },
  "input_sha256": "81CB4D8D1ABC166C8384FCBD8CDAC4D93FE9D925BCF79FF7E6DFAC13D1000BE0",
  "decode_continued_after_rtti_gate": false
 },
 "our_decoder_identity": {
  "lineage": "FIELD_IDENTITY_V2 (SchemaDecoderV2 occurrence-preserving field list; s13 identity model)",
  "scripts": {
   "s14_world_slice_validator_fieldidentity_v2.py": "464D07E5203A8BA1D95ED1B3A5B94C6A932A8AABF979903490C893DD94293C04",
   "s06_world_slice_validator.py": "51AC25406DF00F3A1EED79E6573C779733FC1F95696EE045CE1C27202767BBC0",
   "s04_nifxml_baseline.py": "79A52CFD03595670609146C9D7EED9F7A0C80480C2655606018BE82F03667492",
   "s13_schema_field_identity_v2.py": "E3368507FCA5E9FDAE2AEADC1F9A55137DAEE242FBBDB5F410027C64455B4893"
  },
  "imported_read_only": true,
  "schema_source": "nifxml historical 0.7.1.1 (s04 HIST pin)"
 },
 "input_identity_check": {
  "oracle_sha256": "81CB4D8D1ABC166C8384FCBD8CDAC4D93FE9D925BCF79FF7E6DFAC13D1000BE0",
  "our_sha256": "81CB4D8D1ABC166C8384FCBD8CDAC4D93FE9D925BCF79FF7E6DFAC13D1000BE0",
  "same_input": true
 },
 "items": {
  "block_count": {
   "status": "MISMATCH",
   "oracle": 10,
   "our": null
  },
  "object_count": {
   "status": "MATCH",
   "oracle": 0,
   "our": 0,
   "note": "oracle counts decoded blocks (unknown runs recorded as boundary-only blocks)"
  },
  "type_histogram": {
   "status": "MATCH",
   "oracle": {},
   "our": {}
  },
  "object_ordering": {
   "status": "MATCH",
   "oracle": [],
   "our": []
  },
  "names": {
   "status": "MATCH",
   "oracle": {},
   "our": {}
  },
  "parent_child_edges": {
   "status": "MATCH",
   "oracle": [],
   "our": []
  },
  "local_transforms": {
   "status": "MATCH",
   "compared": 0
  },
  "world_transforms": {
   "status": "MATCH",
   "compared": 0,
   "note": "computed on both sides from identical serialized locals via the identical formula (see float_policy); no independent oracle computation exists"
  },
  "geometry_count": {
   "status": "MATCH",
   "oracle": 0,
   "our": 0
  },
  "vertex_counts": {
   "status": "MATCH",
   "compared": 0
  },
  "triangle_counts": {
   "status": "MATCH",
   "compared": 0
  },
  "uv_sets": {
   "status": "MATCH",
   "compared": 0
  },
  "normals": {
   "status": "MATCH",
   "compared": 0
  },
  "bounding_volumes": {
   "status": "MATCH",
   "compared": 0
  },
  "controllers": {
   "status": "MATCH",
   "oracle": [],
   "our": []
  },
  "properties": {
   "status": "MATCH",
   "oracle": [],
   "our": []
  },
  "texture_references": {
   "status": "MATCH",
   "oracle": [],
   "our": []
  },
  "unknown_blocks": {
   "status": "NOT_AVAILABLE_IN_OUR_DECODER",
   "detail": "oracle reports unknowns ['NiArkAnimationExtraData']; our decoder reports none"
  },
  "parse_failures": {
   "status": "MISMATCH",
   "oracle": {
    "accepted": false,
    "error": "RTTIError(NiArkAnimationExtraData): cannot find create function."
   },
   "our": {
    "accepted": false,
    "error": "ArkBlockError: not 10.1"
   },
   "note": "statuses differ BY DESIGN for NiArk* files: the oracle reports the ORIGINAL fail-closed RTTIError verdict (+partial continuation in full-decode), our decoder accepts; this is the primary finding, not a defect"
  }
 },
 "summary": {
  "counts": {
   "MATCH": 16,
   "MISMATCH": 2,
   "NOT_AVAILABLE_IN_ORACLE": 0,
   "NOT_AVAILABLE_IN_OUR_DECODER": 1,
   "SEMANTICALLY_UNRESOLVED": 0
  }
 }
}
